{
  "meta": {
    "topic": "Network Components: The Hidden Infrastructure Behind Every Message",
    "domain": "MBA",
    "audience": "MBA",
    "subjectName": "Data Communications and Networking",
    "duration": "2 Hours",
    "slideCountPreset": 40,
    "faculty": {
      "name": "Dr. Natraj N. A.",
      "title": "Assistant Professor (Grade-11), SIDTM",
      "institution": "Symbiosis International University, Pune – 412115",
      "email": "natraj@sidtm.edu.in"
    },
    "createdDate": "2026-07-18"
  },

  "theme": {
    "name": "Academic",
    "palette": { "p1": "#D85A30", "p2": "#534AB7", "p3": "#0F6E56", "p4": "#BA7517", "p5": "#185FA5", "p6": "#993556" },
    "fonts": { "heading": "Playfair Display", "body": "Inter", "mono": "JetBrains Mono" }
  },

  "parts": [
    {
      "partNumber": 0,
      "partName": "Title",
      "slides": [
        { "type": "title", "topic": "Network Components: The Hidden Infrastructure Behind Every Message", "faculty": "Dr. Natraj N. A." }
      ]
    },
    {
      "partNumber": 1,
      "partName": "The Current Paradigm and Its Limits",
      "accentRef": "p1",
      "icon": "icon-warning",
      "opening": { "device": "question", "text": "What happens when everyone on Earth tries to talk at once? No single network, however well built, was ever designed to carry that load alone." },
      "slides": [
        { "slideId": "p1-s1", "type": "statement", "headline": "One Network Was Never Going to Be Enough", "subhead": "What happens when everyone on Earth tries to talk at once? No single network, however well built, was ever designed to carry that load alone." },
        { "slideId": "p1-s2", "type": "evidence", "headline": "8.5 Billion Conversations a Day, Minimum", "statistic": { "value": "8.5B+", "label": "searches processed by Google alone, every single day" }, "source": "DemandSage Google Search Statistics, 2025", "contextLines": [ "That's before counting email, video calls, streaming, and every other form of traffic sharing the same global infrastructure.", "Reliably delivering that many simultaneous messages would overwhelm any single network on the planet." ], "bridging": { "kind": "business-implication", "text": "That impossibility is precisely why the internet is built as a web of smaller networks, not one giant one." } },
        { "slideId": "p1-s3", "type": "comparison-matrix", "headline": "Eight Requirements. Miss One, and the Message Doesn't Land.", "columns": ["Requirement", "What Breaks Without It"], "rows": [ { "label": "Sufficient bandwidth", "values": ["Video and large files stall; users abandon the transaction"] }, { "label": "Low latency", "values": ["Voice, gaming, and trading applications become unusable"] }, { "label": "High reliability", "values": ["Every dropped session is a customer support ticket"] }, { "label": "High security", "values": ["Every unencrypted hop is an interception opportunity"] }, { "label": "Large scalability", "values": ["Growth becomes a rebuild instead of an upgrade"] }, { "label": "Compatibility", "values": ["Two devices simply can't talk to each other at all"] }, { "label": "High QoS", "values": ["Critical traffic queues behind a video download"] }, { "label": "Better network management", "values": ["Nobody notices the outage until the customer does"] } ], "bridging": { "kind": "strategic-risk", "text": "Every one of these eight requirements is a design trade-off, not a checkbox -- treating them as optional is how outages and support tickets get budgeted in without anyone noticing." } },
        { "slideId": "p1-s4", "type": "framework-card", "headline": "Why No Single Network Can Do This Alone", "frameworkName": "The Network Trade-off Framework", "diagramLabels": ["Bandwidth pulls toward fiber", "Reach pulls toward wireless", "Security pulls toward a closed, private line", "Cost pulls against all three"], "bridging": { "kind": "strategic-risk", "text": "Organizations that try to run one uniform network for every workload -- voice, video, backup, guest Wi-Fi -- end up over-engineering for some use cases and starving others." } },
        { "slideId": "p1-s5", "type": "strategic-pause", "synthesisStatement": "No single network was ever going to satisfy bandwidth, latency, reliability, security, scalability, compatibility, QoS, and manageability at once -- which is exactly why the internet is a web of smaller, purpose-built networks rather than one giant one.", "reflectionQuestion": "Which one of the eight network requirements is your organization currently sacrificing to protect the other seven?", "actionImplication": "Before signing off on 'one network for everything,' map which requirement each business unit actually needs most -- uniform infrastructure quietly over-serves some workloads and starves others." }
      ]
    },
    {
      "partNumber": 2,
      "partName": "Introducing the Internetwork",
      "accentRef": "p2",
      "icon": "icon-idea",
      "opening": { "device": "question", "text": "Every message you send rides on \"a web of smaller, interconnected networks of various sizes and capabilities.\" However different those networks look, they all share the same four moving parts -- so what are they?" },
      "slides": [
        { "slideId": "p2-s1", "type": "statement", "headline": "A Web of Smaller Networks Is Doing What One Giant Network Never Could", "subhead": "Every message you send rides on \"a web of smaller, interconnected networks of various sizes and capabilities\" -- and however different those networks look, they all share the same four moving parts." },
        { "slideId": "p2-s2", "type": "framework-card", "headline": "The Four Basic Elements Every Network Shares", "frameworkName": "Four Basic Elements of a Network", "diagramLabels": ["Rules (Protocols) -- the standards, like a shared postal addressing format, that let two different devices exchange a message without compatibility issues", "Messages -- the web pages, e-mail, calls, and files being carried, like the letter itself", "Medium -- the copper, fiber, or airwaves the message travels across, like the roads and vehicles", "Devices -- the hardware, from your laptop to a router three networks away, like the post offices that sort and relay"], "bridging": { "kind": "business-implication", "text": "Network sizes and capabilities vary enormously -- these four elements never do, which is why the same framework diagnoses a two-device home network and a global carrier." } },
        { "slideId": "p2-s3", "type": "process-flow", "headline": "A Google Search Is All Four Elements, Working at Once", "steps": [ { "label": "You type a query", "description": "Your device converts keystrokes into a request -- the Message -- the instant you hit enter.", "icon": "icon-data" }, { "label": "The query reaches Google's servers", "description": "It travels across the Medium -- copper, fiber, or wireless -- through a chain of Devices between your laptop and a data center you'll never see.", "icon": "icon-network" }, { "label": "Indexing and relevance ranking", "description": "Governed entirely by Rules -- the retrieval and ranking logic that decides which of billions of pages actually answers your question.", "icon": "icon-process" }, { "label": "Retrieval and snippet generation", "description": "The matching results are packaged into a readable response -- a new Message, built specifically for you.", "icon": "icon-data" }, { "label": "Display result", "description": "The displayed result is the Message delivered -- the same four elements, running in reverse, back to your screen.", "icon": "icon-globe" } ], "bridging": { "kind": "business-implication", "text": "That under-one-second round trip is the payoff of four elements -- rules, messages, medium, devices -- each engineered separately and optimized to work together." } },
        { "slideId": "p2-s4", "type": "framework-card", "headline": "Protocols: The Rule Everyone Forgets to Name", "frameworkName": "Three Jobs of a Protocol", "diagramLabels": ["Encoding -- converts a query into bit streams, then into electrical, light, or radio signals", "Addressing -- stamps every message with a source address, a destination address, and application details", "Compatibility -- guarantees two different devices can exchange a message with no compatibility issues"], "bridging": { "kind": "business-implication", "text": "When a vendor claims 'seamless integration,' what they are really claiming is protocol compliance -- ask which standards, not just which brand." } },
        { "slideId": "p2-s5", "type": "evidence", "headline": "One Query, Milliseconds, Billions of Pages", "statistic": { "value": "<1", "unit": "sec", "label": "average time for a Google search to complete end to end" }, "source": "Google Search infrastructure documentation; DemandSage Google Search Statistics, 2025", "contextLines": [ "That's despite touching an index of hundreds of billions of web pages.", "And traversing multiple independent networks along the way." ], "bridging": { "kind": "business-implication", "text": "That speed is not an accident of one fast machine -- it's the payoff of four elements, each engineered separately and optimized to work together." } },
        { "slideId": "p2-s6", "type": "strategic-pause", "synthesisStatement": "A network is just Rules, Messages, Medium, and Devices working together -- the same four elements whether it's a Google search or a postal system, at any scale.", "reflectionQuestion": "When a vendor promises 'seamless integration,' which of the four elements are they actually guaranteeing -- and which are they quietly leaving to you?", "actionImplication": "Push every network vendor conversation past the marketing language and ask which protocols, not which brand, before you sign anything." }
      ]
    },
    {
      "partNumber": 3,
      "partName": "The Architectural Shift",
      "accentRef": "p3",
      "icon": "icon-process",